{
  "provider": "gh",
  "category": "deploy",
  "runtime-profile": "subprocess",
  "default-timeout-seconds": 600,
  "file-extensions": [],
  "version-range": ">=2.0.0",
  "scope": "project",
  "description": "Publish a plugin release to GitHub Releases via gh CLI — deploy adapter for /gaia-deploy Pattern A."
}
