{
  "provider": "axe-core",
  "category": "a11y-scanner",
  "version-range": ">=4.0.0",
  "runtime-profile": "subprocess",
  "default-timeout-seconds": 120,
  "file-extensions": [],
  "scope": "project",
  "description": "Deque axe-core accessibility scan via @axe-core/cli — invokes `axe <url> --tags wcag2a,wcag2aa --save - --stdout` and emits a normalized analysis-results fragment for the WCAG rubric judgment."
}
