{
  "provider": "shellcheck",
  "category": "linter",
  "version-range": ">=0.7.0",
  "runtime-profile": "subprocess",
  "default-timeout-seconds": 60,
  "file-extensions": [".sh", ".bash"],
  "description": "ShellCheck static analyzer for sh/bash scripts. Six critical rules (SC2086, SC2154, SC2046, SC2068, SC2155, SC2178) emitted as severity=error; all other rules as severity=warning (advisory)."
}
