{
  "provider": "k6",
  "category": "perf-tool",
  "version-range": ">=0.45.0",
  "runtime-profile": "subprocess",
  "default-timeout-seconds": 300,
  "file-extensions": [],
  "scope": "project",
  "description": "k6 load and performance testing — invokes `k6 run --quiet --summary-export=-` against a target URL, emitting a JSON summary fragment for SLO and baseline-regression checks."
}
